Terrific purchase awesome  	5
Excellent camera is excellent in right light condition..average in low light.. .overall satisfactory  	5
SuggestPhone Review: Great Phone with Bad Selfie Camera I ordered it for review purpose in the first sale on 3rd May. I updated the device after first boot which added face unlock. Writing this review after 3 days of use. Pros: + Good Build + Beautiful Display + Powerful Chipset + Stock Android + Lag Free Performance + No Heating + Massive 5000 mAh Battery + Great Audio + Decent Rear Cameras + Dedicated MicroSD Slot Cons: - Below Average Front Camera - No Quick Charging - No Type-C Port - Weird Camera Interface - No Case/Cover Provided Ratings:...  	4
Super! super value for money and good battery backup  	5
Perfect product! Very nice phone at this price range.Highly recommendable.  	5
Terrific awsm mobile...happy with it....dont listen to other....believe me...it is really unbeatable  	5
Wonderful Must buy    I use 7 days after my opinion  Some pros: * displays  good  * battery backups good *software good *no heating issue  *value of money Cons *camera is ok  *charging time 2hr 39min. *some bugs issue  	5
Terrific very nice mobile camera phone asus  	5
Fabulous! product is just steal deal at this price. you will not regret after buying this product.  	5
Perfect product! Awsm phn. Cmra quality is good  	5
Classy product value for money product. stock Android . long lasting battery  	5
As expected...!! Actually I have to give it 4.5 stars. First of all the delivery by Flipkart was amazing fast, within 48 hours I received my parcel. Talking about the packaging, it was fine but not up to the mark. Now talking about the box contents, the box include smart phone wrapped in plastic also including some paperwork a charger brick including a USB to micro USB cable. Also the box has an unexpected utility which is known as sound box according to Asus.                -Now talking about the handset, th...  	4
Perfect product! Perfect comeback by Asus. Asus phone market was sort of dead .But now it has made a come back with a bang. The phone is more than value for money. Pros: 1.Humugous  battery life. 2.2018 display (18:9) 3.snapdragon 636 at 11k(mi is selling at 15k) 4.decent rear camera  5.Stock android with 8.1 out of the box. 6.dual 4g standby 7.no heating issue 8.Dedicated sd card slot Cons: 1.Below average front camera. 2.no 5ghz WiFi. You won't regret later for buying this phone.  	5
Excellent battery life is fabulous 36 hours  of battery life with gaming, browsing,and with all heavy using.camera is awesome i gave some sample of images..front camera is also very good..but at low light performance you will be disappointed..all over a budget phone with all good thing you need..build quality is also good..loud speaker is also awesome..you can feel the beat of the songs also..allover it's a super value phone...don't think twice just go for it..you will fall in love with this device   	5
Brilliant nice budget phone great camera quality  	5
Brilliant Awesome mobile in this price range. camera is good,but overall performance is mind blowing.  	5
Great product Got it today... Awesome in look. Everything is good. Just need improvement in front camera.... Didn't get face unlock update yet... Happy with my asus zenfone max pro.   	5
Must buy! I can say just one word about the phone it just awsm....  	5
Perfect product! An Awesome Device with 1-2 flaws! First of all thanks to Flipkart for an excellent delivery, Received it on Saturday. **UPDATE** After a week of Use No complaints except for the Front Cam. Everything Working like a Charm! Battery Life is the main Pro of this Device! Getting 1 Day 14 Hours of Battery Life with almost 12 Hours of SOT with 4G enabled. And For the Fact, I Stream a lot Online . My Review after almost 3 days of use Pros:- 1. Vivid Display with great Colors 2. Great Battery life ...  	5
Terrific grey looks better than black  	5
Terrific don't stuck in negative reviews..just go for it. the major issues which all are talking fingerprint and cameras. fingerprint sensors are improving much by updates..hope they will fix it soon. Both cameras of the phone are nice..the problem is with the app..that was waste..if we are installing Google cameras then you can feel the difference (major issue for this is this can done only through rooting). front cam is improving..but now also I'm not satisfied..but future updates will may improve i...  	5
Just wow! I got it for my father...He fully satisfy with the battery and performance...best phone in budget  	5
Pretty good Great phone...front camera need to improve. bettery is good. face recognition working fine.. gaming experience is awesome.  superb phone in this rang..  	4
Great product Best phone under the budget!! Superb battery, good camera and crisp display!!!  	5
Would recommend this if you don't bother much about camera I'd really recommend one to buy this phone. But do have a look at few factors. * Camera : 4/5   There is some problem with the quality of photos taken with the front camera. It doesn't seem like 8 MP camera. But I am sure ASUS will improve it through OTA updates.  Coming to rear camera it's performance is pretty good. It's on par with Redmi note 5 pro  (except during low light condition) * Performance : 5/5 No words... It's just amazing. We get to see the absolute amazing performance of the...  	5
Just wow! one of the best mobile phone this price range Camera  8/10 Battery 10/10 Display   9/10 Value for money 9/10 performance 10/10  	5
Wonderful So Beautiful Mobile With Unique Features Simply Camera Awesome And Osm Mobile..  	5
Classy product superb phone battery life very good smooth display superb quality camera face unlock budget phone if you want to buy a budget phone under 10k to 15k you should buy it without worry  	5
Terrific purchase exciting  	5
Good quality product Looks and display is very good. battery is decent. expected more backup as I am just a normal user(no gaming) but it was down to 60% in general browsing in 4g.  download and browsing speed is fast. camera is not good for the given pixel. hope they improve camera performance in future updates. I am switching from Windows to Android. couldn't find any import or export function for copying contacts from my old phone.  it fell short of my expectations. After OTA  update battery is working proper...  	4
Fabulous! it's a very good product within 11k range  	5
Great product I liked everything about it till now. Though I haven't used much. Lets see how it works. Excited and nervous too, hope everything goes well. Thanks Flipkart.  	5
Awesome good..  	5
Brilliant Best phone you can buy in this price range. Bit disappoint in camera, Except that all are superb. #Paisavasol mobile  	5
Simply awesome Awesome mobile better than redmi pro after comparing both mobile manly battery backup, sound and gaming.  	5
Wonderful very gud display I love it very much also its very speed when switching apps sound is awesome  camera is very guddd only one thing is need to improve finger print speed and face recognizes otherwise Sema phone........  	4
Good choice  awsm 1.  	4
Really Nice Undoubtedly a nice phone and best deal by Asus... The only thing Asus need to work on camera performance ...waiting for another good OTA for Asus to overcome this single issue ....otherwise this phone worthy in this price bracket .. utlimate experience using this Asus Zenfone max pro M1 ...good to buy because of its screen, battery, processor performance, network reception, display colour ram management etc.  	4
Excellent No word to say .... must buy  	5
Wonderful I loved it it's nice and wonderful mobile...for cheap price and best ....mobile for this price..and I got where soon.....  	5
Must buy! its camera can do wonders in good lighting condition..! plus its battery backup is superb and also runs smoothly due to SD 636 and the latest android os...! Better than Rn 5 pro coz of the lower price and looks..!  	5
Good quality product nice looking & great budget phone  	4
Worth every penny fantastic camera .. as a photographer feeling much more happy  	5
Brilliant just Awesome phone  	5
Brilliant The perfect budget friendly phone for youth.. Awesome Asus Zenfone max pro m1 is the best according to me.. The camera quality is awesome.. zero lag issues till date.. I have been using it for 20days.. Flipkart thanks for the super fast delivery.....  	5
Awsm after using two month wrtng this review . . Didn't face any problm no heating , no lag, battery bckup awsm, camera performance was also good, ya it need improvement in camera section but its not a major issue fr me . . .Face recognition, and fingerprint scanner work fantastic  	4
Best in the market! recieved today..!! satisfied with the premium look and decent specifications in given 11k price range.. totally worth of buying..!!   	5
Terrific purchase I have oneplus5T I compared the speed of tthis phone with it and Asus speed  is same as oneplus5t it downloads everything very fast .YouTube videos,photos,webpages etc (.I dint download Facebook app that FB app slows down all mobiles.)this phone has lovely display ( u have to adjust in settings for magnify gesture to get 18:9 of YouTube videos).The design is same as oneplus5t it's very pleasant to hold the phone ( without back cover).Audio is not bad .wifi pick is excellent it pulled all WiFi...  	5
Delivery / Performance Super fast delivery (within 40 hrs), value for money ,very good battery(70 % after 4 hr Wifi Video)  	5
Great product 1st review after one full day usage: Came with battery 60%, was dropping very fast. Dropped till 30 in 2hrs of heavy usage. Slight heating noticed. Got FOTA update. Switched off at 25% charged till full, took 1hr 40mins with the bundled charger. 3pm yesterday. Since then using bit more than normal usage and current battery state is 30% after almost 1 full day. For heavy users it may not last more than a day, expected bit more. Coming to device performance, just excellent! No lags at all anywh...  	5
Just wow! for all except Camera DISPLAY  BATTERY DESIGN  OREO  **** Awesome*** Only problem is Camera not so good and a bit slow fingerprint hope it get fixed by an OTA update soon. Worth Money Overall  	5
Nice product the mobile is actually nice. the display is great. the speakers are nice. good battery backup eventhough used only for a day. Stock andorid with 3 Asus pre installed app although did not receive face unlock update. The fingerprint sensor is good but takes .5 second to unlock. The camera is little disappointing but its ok not that much bad. Tried taking photos its good for normal use. The performance is good with games and other softwares. If you are looking for an all-rounder this is phone wi...  	4
Best in the market! Best for the price.  Excellent Battery Great Display Great Build Good Speakers Decent Cam( You can take great pictures if you are a good photographer) The Phone is very fast and has got all what it takes to be the budget king. P.S. Don't forget to get a tempered glass protection  with the phone.  	5
Good quality product every thing is fine but sometimes it gets heated and battery backup isn't that good......but according to price its d best product  	5
Very Good I have got the phone yesterday and have been using it since then. So i'm gonna write a review on the pros and cons of the phone i felt after using it. PROS: +BATTERY - It is having good battery backup. I charged the phone fully and used from 6pm to 10pm continuously and the battery was down to about 53%.  +SCREEN - The 18:9 fhd display is looking good with nice colour reproduction and good contrast. +UI - Stock Android is smooth and Easy to use +GAMING- I played PUGB and it runs very smoothly...  	4
Must buy! THIS CELLPHONE IS TOO FAST.... And lot of update will come in this mobile in future also  Good work ASUS    ALL THINGS ARE AWESOME IN THIS MOBILE.....DON'T LISTEN TO OTHERS .....GO FOR IT..  	5
Terrific JUST WOW!!!!!   Closely follows ASUS....AND THIS JUST UNBEATABLE... ....BEATS THE NEAREST RIVALS.......REDMI NOTE 5 &REDMI NOTE 5 PRO...  	5
Super! first of all i want to thanks Flipkart team ... for the fastest delivery ..... nd what to say about asus zenfone .... it is above alll limitations ...  	5
Worth every penny mobile is good...but delivry time is very bad...i will never buy a product from u again...bye bye flipkart ...very very poor delivry by ekart ...  	5
Best in the market! Great come back by ASUS! Just read this once and i am sure your doubts will be cleared. The Pros as already mentioned in detailed summary in specifications.  So, directly coming what are the drawbacks yet present in this phone. The only cons present in this phone yet that the sharpness as seen in 'Redmi Note 5 Pro' is missing in Zenfone Max Pro M1 in the pictures that shoot from front camera (however, the same will be issued soon by OTA updates). Call recording, Ultra Power Saving Mode, Mu...  	5
Wonderful awesome display and battery back up with descent cameras.OTA update gave a change.... it is a best alternative for redmi note 5 pro.iam using note 5 pro too but Asus rear camera is better than note 5 pro and front cam is good in note 5 pro .Display and battery are the  highlight. gesture control is gud. thank u Flipkart and asus.  	5
Excellent love you asus  	5
Super! Best Mobile under 11k . Camera Colour saturation Better than Mi note 5 pro . Disappointed at Night Photography . Build Quality Simply Superb . Amazing Battery life . Front Camera Gives Raw footage to us. I will Upload Photos from Back Camera and front Camera . front camera Raw footage to Colour corrected . Photos  1.Back camera outdoor 2.Front camera 3.Colour corrected  4.Back camera indoor 5.Back camera outdoor .  	5
Good After update camera quality has not improved  i have to downgrade my rating cause this is a BUGGY PHONE OF THE YEAR  	4
Great product Excellent performance but front camera is not good  	5
Killer of Redmi Note 5 pro Best phone under  under 12000 K, I am sure this phone will overcome Redmi note 5 pro if Asus make open sale.I got this phone in 3 days(8 day before as they guaranteed)  Box includes: Phone, Data cable, wall power adapter and user manual. Pros: + Super smart phone +Awesome battery life + Gorgeous display + Excellent build quality + good rear camera with  + Looks very premium + No heat, no lagging. + Great connectivity package - 4G, Dual SIM,  +Triple slot +stock android Cons: - No fast charg...  	5
Worth every penny the best smart phone value of money but Asus did a mistake they didn't provide a case with it  	5
Terrific I am now using this for more then 10 days. So far it has been great experience. just for the reference, i am using galaxy S8 and pixel 2 mobiles and bought this for my son. i am really surprised to get this kind of performance in just 11000 Rs. no lags, super smooth, i don't feel any difference while using this mobile or pixel2. Screen is fantastic, battery life is amazingly good, it goes up to 4 days with about 7.5 hrs screen on time. Rear camera is again very nice. Actually for the price,  ...  	5
Terrible product don't buy this phone I received a faulty product there is a some scratches over the screen and also there is a charging issues in the phone and Flipkart doesn't take a responsibility of replacement i had lost my money please never buy this phone  	1
Mind-blowing purchase ITS FINGER PRINT SENSOR STOP WORKING AT ALL AFTER THE AUGUST UPDATE PROVIDED BY ASUS AND THERE IS  NO EXISTING SOLUTION GIVEN BY ASUS ON THAT PROBLEM.......best smartphone in this price range best battery life 5000mah.......no lag in gaming or multasking.......camera gets better with the update.....fingerprint and face unlock also got better with latest update........best part is stock andriod experience which result is high performance compared to other devices  	5
Terrible product it's overheating even before using. Reached out to Flipkart agent & she said reboot & reset & kept on repeating the same thing again & again. & finally rejected the return request Terrible Experience.  	1
Excellent Bought this on First Sale with 1year Protection Plan. Before giving brief review let me clear one thing, is that I was not happy with Preorder and product getting delivered almost 1 week after order. Review with Pros and Cons briefly described: 1. Good build quality. No complaint whatsoever. Design is plain and simple. 2. Display is quite brilliant for a device under 15K. 3. Battery life is extraordinary. I actually got bored doing battery test with this. There is no way you can discharge th...  	5
Value for money Good in hand feel and best specifications but few cons are 1- no screen protection (i.e no gorrila glass). 2-front selfie flash is really pathetic.(luminous intensity is very low). 3-fingerprint scanner is slow . 4-EIS  is now available after OTA update but it's not impressive . 5- instead of snapdragon 636 fast charging is not supported on this device.(takes more time to charge about 2.5-3hrs). Rest in every department this phone is bang on target  1- On moderate usage I get 2 days batte...  	5
Worth the money pros. camera good display fine  size good performance smooth finger sensors good value for money cons front camera average  	4
Good mobile in 11000 Rear  camera 8/10 Front camera 6/10 Battery 10/10 Screen 10/10 Spiker 9/10 Head phone after etra bass app download 9/10 Touch 10/10 Chrge time 0 to 60 9/10 60 to 100 7/10 Internet speed 10/10 Call quality 10/10  	4
Just wow! Great phone from 11K.Rear camara is excellent but selfie camara is average.  	5
Highly recommended awesome phone  	5
Worth every penny Superb mobile  	5
Must buy! I am writing this review after a long term usage. I bought this phone on the first day of sale itself. 1.Over all design is good the camera module doesn't protrude it goes with body itelf.  2.Performance is snappy apps open fast sometimes a bit buggy. Can be improved on future update. If you guys play PUBG this is the phone to play. Gaming is smooth. No heating issue at all. It gets warm but it is usual for very smart phone out there. 3. Battery is greatly I was getting around 9.5 hrs of scre...  	5
Mind-blowing purchase The mobile is awesome however i havent received any FOTA updateas so far.  Have any body of you got any sw update??  	5
Highly recommended super..  	5
Nice product good phone  	4
Must buy! Definitely the best specifications at this price range. have A look at practical usage Pros: Best in class display. Speaker is awesome as said by asus it is much louder clear than other 15k segment smartphones. Great battery life(thamks to its huge 5000mAh battery)  on even heavy useage it will easily last for whole day.. and for normal usage it lasts for 2 days. Clean UI as it runs on stock android and you will get OTA updates faster. Design is good and it still looks slimmer dispite of...  	5
Mind-blowing purchase Price - reasonable battery - fantastic camera - back camera is very good frnt camera ok ok performance- superb display - good  	5
Perfect product! Outstanding performance by Asus at this price segment. I suggest you to go for it , if you want a budget smartphone.  	5
Good quality product Camera department is just fine. Apart from that phone's absolute beast.  back up, display, robustness all above par. The king phone of 11K range. If budget is 10K, add 1K and go for it. #HappyAsusUserFromLast4Years.  	4
Super! Best mobile it is! actually it's not pure black in colour! it is deep blue! the colour is better than  black!  Bigttery life; Big Screen, Good processor! Camera-Satisfied! No heating problem al all! finger print sensor is little slow! gaming experience is awasome! better than any mobile available in  market now! overall its an awesome experience.  	5
Best in the market! in this price range it's very good mobile with good battery backup & decent camera don't believe all fake reviews....  	5
Simply awesome Excellent mobile at that price. I think we shouldn't ask for more at that price. Pros: * Good build quality. * Excellent display. * Powerful processor. * Loved the stock android.  * Face unlock works well. * Good battery backup. * Both SIMs support VOLTE. Cons: * Somewhat poor camera interface and picture quality. I hope Asus will provide software updates on fixing it.  	5
Hated it! Honestly it is a over rated mobile. Spec wise it seems better than competitors but performance and quality is not up to the mark. I got this phone 3days ago as a replacement for my Lenovo VIBE K5 Note. Below are my ratings 1. Rear camera  : 1 out of 5 (images are blurry, noisey  and not sharp irrespective of all modes) 2. Front camera : 0 out of 5 (Auto white balance and image quality are worst)  3. Display : 2 out of 5 (color reproduction is bad for the resolution and size, bad contrast rati...  	1
Delightful This phone is very good in this budget range  pros  1.good 5000mah battery life  2.nice 16:9aspect ratio  3.colour contrast is good  4.it has face unlock  5.latest Snapdragon processor  6. Stack android  cons  6. Latest Android version  1.camera is not that good it's colour saturation is not that real . It gives yellow light in flash that doesn't make photos look good in flash . It only gives good pictures when there is more brightness in the room  2. Due to 2.5 D curvature you won't find a t...  	4
Awesome First Of All it is a killer of Note 5 Pro.Decent camera.But need little improvement in Front one.Value for money product.Remember it's a pure  stock Android.No hang issue till now.If you like customization then choose another one.Overall 9.5/10 including everything.Go For It  	5
Worth every penny great phone under 11000. battery power super. fantastic dual camera .audio quality fantastic with boat bass compared using with Lenovo k6 and Redmi note 4.snapdragon processor doing everything without any time-lag. better to use back cover as it is slippery.  	5
Perfect product! special thanks to Flipkart for giving best delivery service . delivery date is expected on 15 may and I got it on 7 may  Asus Zenfone max pro is great phone as I am continuously from 2 day  front camera and fingerprint scanner disappoints me but except like battery ,display ,audio ,video, is great  and if you are going to buy redmi note 5 pro  then I suggest you go for it as it is cheaper then redmi  	4
Mind-blowing purchase Amazing phone for a great price. I was in a dilemma between this phone and Nokia 7 Plus. I was leaning towards Android One, but after seeing tons of review about Asus Max Pro i thought of giving it a shot since its less than half the price of Nokia 7 Plus.  And I'm truly satisfied with my purchase. Pros: 1) Battery 2) Display - This is the best screen on a phone for <13k 3) OS - Its just Pure Android with 2-3 ASUS customised features 3) Built quality 4) Earpiece speaker Cons: 1) Camera - I...  	5
Nice product GOOD PRODUCT FROM ASUS - WORTH FOR MONEY - NICE TO HANDLE - PROS: SCREEN SIZE - 5.99', FACE LOCK, BATTERY CAPACITY, HARDWARE, NO HEAT PROBLEM, GOOD DESIGN, SUPER AUDIO, DEDICATED SLOT FOR 2 SIMS & SD CARD.                                                                         CONS: BATTERY NOT LIKE 5000MAH - CAN WITHSTAND 1 FULL DAY WITH NORMAL USAGE, LITTLE SLOWER, NO FAST CHARGER - IT TAKES 2.30Hrs TO CHARGE FROM 5-10%, AVERAGE CAMERA, NO GORILLA GLASS.                                     ...  	4
Not better Some time heat up and battery performance poor.after Software update pH performance is poor.  	1
Very Good At this given price , just go for it. Impressed with this phone performance and near stock android is one more awesome thing to boost about this phone. Huge battery. Overall a best and must buy budget smartphone.  	4
Good quality product front camera not good display colour black not good native video call problem i am using for 30 days this phone average not very high  	4
Simply awesome 1.Audio quality not good on 3.5 mm jack while watching YouTube and other video player. I have compared this to redmi and realms 1. 2.No EIS feature added in camera.No slow motion video recording. 3.front camera not up to mark.Same 8mp good quality on OPPO realme 1. 4.No AI features available. 5.Auto brightness sensor not working properly. 6.Poor battery backup.Dont buy it. 7.auto brightNess sensor not working properly. 8.OPPO realme 1 is better option at 9000 than this. 9.Snapdragon audio plu...  	5
Terrific it's really awsm, Far better than Redmi note 5 pro..  	5
Super! it's a value for money but if u play pubg on it u can face some frame drop after the last sanhok update so don't worry I bought it on August that time the game was running smooth like butter in medium/hd graphics but after the sanhok update released on sept. it started having some frame drop issues I think the game only has some optimization issues and after the next pubg update rolls out I think it will be all okey. . display-is great . battery-good . camera-average(doesn't have optical ima...  	5
Android ONE saga along with SD 636 After 1 day of usage :  Display --- I have watched lots of YouTube Videos in 1080p, couple of movies (E.g. - Monster University, Inception, 3 idiots), played Asphalt 9, Watched couple of live stage performances etc. Everything is quite satisfied to my eyes and contrast + color accuracy + sharpness is brilliant. So, Recommended [10/10] Camera --- Back camera is more than enough for day to day life photography and video recording via back one is good [bit shaky but manageable].  Front is just...  	5
