Terrific purchase awesome  	5
Nice product GOOD PRODUCT FROM ASUS - WORTH FOR MONEY - NICE TO HANDLE - PROS: SCREEN SIZE - 5.99', FACE LOCK, BATTERY CAPACITY, HARDWARE, NO HEAT PROBLEM, GOOD DESIGN, SUPER AUDIO, DEDICATED SLOT FOR 2 SIMS & SD CARD.                                                                         CONS: BATTERY NOT LIKE 5000MAH - CAN WITHSTAND 1 FULL DAY WITH NORMAL USAGE, LITTLE SLOWER, NO FAST CHARGER - IT TAKES 2.30Hrs TO CHARGE FROM 5-10%, AVERAGE CAMERA, NO GORILLA GLASS.                                     ...  	4
Not better Some time heat up and battery performance poor.after Software update pH performance is poor.  	1
Very Good At this given price , just go for it. Impressed with this phone performance and near stock android is one more awesome thing to boost about this phone. Huge battery. Overall a best and must buy budget smartphone.  	4
Good quality product front camera not good display colour black not good native video call problem i am using for 30 days this phone average not very high  	4
Simply awesome 1.Audio quality not good on 3.5 mm jack while watching YouTube and other video player. I have compared this to redmi and realms 1. 2.No EIS feature added in camera.No slow motion video recording. 3.front camera not up to mark.Same 8mp good quality on OPPO realme 1. 4.No AI features available. 5.Auto brightness sensor not working properly. 6.Poor battery backup.Dont buy it. 7.auto brightNess sensor not working properly. 8.OPPO realme 1 is better option at 9000 than this. 9.Snapdragon audio plu...  	5
Terrific it's really awsm, Far better than Redmi note 5 pro..  	5
Super! it's a value for money but if u play pubg on it u can face some frame drop after the last sanhok update so don't worry I bought it on August that time the game was running smooth like butter in medium/hd graphics but after the sanhok update released on sept. it started having some frame drop issues I think the game only has some optimization issues and after the next pubg update rolls out I think it will be all okey. . display-is great . battery-good . camera-average(doesn't have optical ima...  	5
Android ONE saga along with SD 636 After 1 day of usage :  Display --- I have watched lots of YouTube Videos in 1080p, couple of movies (E.g. - Monster University, Inception, 3 idiots), played Asphalt 9, Watched couple of live stage performances etc. Everything is quite satisfied to my eyes and contrast + color accuracy + sharpness is brilliant. So, Recommended [10/10] Camera --- Back camera is more than enough for day to day life photography and video recording via back one is good [bit shaky but manageable].  Front is just...  	5
Terrific purchase Great smartphone at a great price. Pros:  1. Great display for the price. 2. Looks sleek even though it has a 5000mAh battery. 3. Nice design and build quality. 4. Cameras are great after installing Google camera mod by enabling camera2api. Pictures deliver excellent details and good dynamic range.  5. Video stabilization is available on google cam even upto 4k and video quality is good. 6. Good battery life (scope for improvement). 8. Really good performance. SD 636 is fast and stable and ga...  	5
Worth the money Complete Package in 11k but bad selfie camera in low light  My Ratings- 4.5 After use of 4 days and 14th June Update: Pros: 1) Display & Built Quality Is premium. Though screen display is 5.99 inch it can easily be gripped. 2) No Lagg till now. 3) Good rear camera and portrait mode glorifies it more. 4) 5000 mAh massive battery lasts till 1.5 days with 2.5-3 hours of gaming. You can trust it for a full day with heavy usage. 5) Processor is very fast and excellent... can handle heavy games wit...  	4
Great product after use of around 1 months mobile are best not face any problem  battery backup is best performance is best back camera is average front camera is average Paisa vasul  	5
Mind-blowing purchase Excellent mobile with a very good price... camera is dam good... happy with asus  	5
Hated it! Battery performance is not good as comparison to 5000mah.Very bad support from Flipkart and their service provider company jeeves. Refund policy is only to show. They do not apply these refund services. Very very bad experience.  	1
Did not meet expectations Display problem, sound problem, can't hear clear voice when calling...... And more.....  	1
Great product better than redmi not 5 pro  	5
Nice product wow.... the best phone I got @ this price...  pics are better in daylight.  	4
Not good everything good in this phone only the problem is its front camera. after all update camera performance is very artificially and bad it may be a deal broker point. its not able to stand front of redmi not 5 for camera  	2
Pretty good phone looks premium and display quality is great and battery lasts for around a day and a half with heavy usage only thing I didn't like is the camera ,front camera is below average and in rear camera the pics look oversaturated  	4
Don't waste your money Very bad performance, getting error while opening Camera "Can't connect to camera" and "System UI error". Performs very slow.  Lack of camera features like Slow motion videos, Timelapse. Double tap to awake screens fails all the time.  	1
Absolute rubbish! Good product but bad service by Flipkart Phone is good but had some issues build quality is not upto mark and screen display has some issues but Flipkart refused to replace it not satisfied with Flipkart service  	1
Awesome Osm Price Good phone camera Quality  Bumper  	5
Best in the market! I am very happy to this product. Nice product by Asus. Again thanks to Flipkart...  	5
